{
  "project_id": "client-demo",
  "schema_version": "2.2.0",
  "workspace_type": "short-video-ops",
  "operating_mode": "commercial",
  "workspace_index": "workspace.index.json",
  "workspace_policy": "workspace.policy.json",
  "data_contract": "data.contract.json",
  "data_policy": {"contains_private_data": true, "commit_allowed": false, "public_export_allowed": false},
  "current": {
    "account_profile": "config/profile/account.profile.json",
    "offer_profile": "config/profile/offer.profile.json",
    "audience_profile": "config/profile/audience.profile.json",
    "strategy_brief": "config/strategy/strategy-brief.json",
    "strategy_weights": "config/strategy/scoring-weights.json",
    "topic_discovery_policy": "config/policies/topic-discovery.policy.json",
    "topic_selection_policy": "config/policies/topic-selection.policy.json",
    "benchmark_mining_policy": "config/policies/benchmark-mining.policy.json",
    "account_snapshot": "data/operations/current/account-snapshot.json",
    "content_performance": "data/operations/current/content-performance.json",
    "strategy_assessment": "data/topic-research/current/strategy-assessment.json",
    "topic_signals": "data/topic-research/current/topic-signals.json",
    "audience_signals": "data/topic-research/current/audience-signals.json",
    "market_signals": "data/topic-research/current/market-signals.json",
    "pain_bank": "data/topic-research/current/pain-bank.json",
    "competitor_map": "data/benchmarks/current/competitor-map.json",
    "reference_bank": "data/benchmarks/current/reference-bank.json",
    "topic_candidates_conservative": "work/topics/conservative/current.json",
    "topic_candidates_experimental": "work/topics/experimental/current.json",
    "topic_selection": "work/topics/selections/daily.json",
    "daily_plan": "work/plans/daily.json",
    "publishing_plan": "work/plans/publishing.json",
    "published_posts": "data/feedback/raw/published-posts.json",
    "post_metrics": "data/feedback/raw/post-metrics.json",
    "feedback_learning": "data/feedback/current/learning.json",
    "strategy_delta": "data/feedback/current/strategy-delta.json"
  },
  "artifacts": {
    "dashboard_status": "presentation/status.json",
    "dashboard_data": "presentation/ops-dashboard.json",
    "dashboard_html": "presentation/internal-pages/运营大盘.html"
  },
  "workflow_manifests": {
    "auto_ops_diagnosis": "manifests/01-auto-ops-diagnosis.manifest.json",
    "pain_bank_builder": "manifests/02-pain-bank-builder.manifest.json",
    "strategy_confirmation": "manifests/03-strategy-confirmation.manifest.json",
    "reference_mining": "manifests/04-reference-mining.manifest.json",
    "reference_research_plan": "manifests/04a-reference-research-plan.manifest.json",
    "reference_transcript_download": "manifests/04b-teaching-script-mining.manifest.json",
    "reference_strategy_deconstruction": "manifests/04c-reference-strategy-deconstruction.manifest.json",
    "reference_bank_ingest": "manifests/04d-reference-bank-ingest.manifest.json",
    "topic_candidates": "manifests/05-topic-candidates.manifest.json",
    "topic_candidates_conservative": "manifests/05a-topic-candidates-conservative.manifest.json",
    "topic_candidates_experimental": "manifests/05b-topic-candidates-experimental.manifest.json",
    "topic_selection_mix": "manifests/05c-topic-selection-mix.manifest.json",
    "script_planning": "manifests/06-script-planning.manifest.json",
    "copy_optimization_reference_match": "manifests/06a-copy-optimization.manifest.json",
    "feedback_learning": "manifests/07-feedback-learning.manifest.json",
    "daily_ops_loop": "manifests/08-daily-ops-loop.manifest.json"
  }
}
